title,price
Ubisoft Assassin'S Creed Mirage | Standard Edition | Playstation 5,"₹2,727"
PS5 Assassin's Creed Valhalla,"₹1,699"
Assassin's Creed: Free Comic Book Day 2016,₹0
Assassin’s Creed: The Ezio Collection (PS4),"₹1,299"
Assassin's Creed IV: Black Flag (PS4),"₹1,199"
Assassins Creed: Odyssey (PS4),"₹1,122"
Assassin's Creed Mirage |Deluxe Edition | PlayStation 4,"₹2,877"
Assassin's Creed Valhalla Drakkar Edition (Free PS5 Upgrade),"₹1,689"
Assassins Creed III Remastered (PS4),"₹1,649"
Assassin's Creed Origins (PS4),"₹1,199"
Assassin’s Creed: Rogue Remastered PS4 (PS4),"₹1,099"
Ubisoft Assassin'S Creed Mirage|Deluxe Edition|Playstation 5,"₹1,066"
UBI Soft Assassin's Creed Valhalla Standard Edition (PS4) (Free PS5 Upgrade),"₹1,930"
Assassin's Creed,"₹1,195"
